{"schema_version":"1.0","matter_id":"GI-COUNCIL-PROXY-DELEGATION-SCHEDULE-001","motion_sha256":"50c33099246c7780547c1d3d81b817e338c4680fbbd6f4bd770459baeecd917e","office":"composer","reviewer_id":"agent-composer-proxy-schedule-20260812-h","disposition":"table_for_human_steward_disposition","deliberation":"The accelerated components compose only when Motion A infrastructure and shadow evidence precede any Motion B exception. Credential-lease simulation remains separate from credential authority, and operational replay remains separate from constitutive integration. The proposed sequence preserves those boundaries.","discharged_obligations":["Checked lifecycle, role, evidence, and authority integration under the compressed plan."],"findings":["Parallel work is safe only behind immutable interfaces and ordered gates."],"amendments":["Correlate authorization intent, simulated execution, readback, and compensation without treating any as institutional effect."],"residual_uncertainty":["Late interface churn may invalidate parallel evidence."],"evidence_refs":["governance/council_matters/GI-COUNCIL-PROXY-DELEGATION-001/reviews/08-composer.json","governance/council_matters/GI-COUNCIL-PROXY-DELEGATION-SCHEDULE-001/proposal.md"]}
