{"schema_version":"1.0","matter_id":"GI-COUNCIL-PROXY-DELEGATION-SCHEDULE-001","motion_sha256":"50c33099246c7780547c1d3d81b817e338c4680fbbd6f4bd770459baeecd917e","office":"formalist","reviewer_id":"agent-formalist-proxy-schedule-20260812-e","disposition":"table_for_human_steward_disposition","deliberation":"The schedule is contractible because it defines an exact duration, ordered predicates, artifact cutoffs, and fail-closed terminal states. Undefined terms, open allowlists, unknown classification, absent role matrices, or failed readback predicates remain false and block submission.","discharged_obligations":["Reduced accelerated completion to explicit predicates and state transitions."],"findings":["Time expiry cannot change a predicate from unknown to true.","PT72H requires exact UTC endpoints in the opening record."],"amendments":["Validate deadline equals effective_at plus PT72H before any work is credited."],"residual_uncertainty":["A schedule-opening validator does not yet exist."],"evidence_refs":["governance/council_matters/GI-COUNCIL-PROXY-DELEGATION-SCHEDULE-001/proposal.md","src/grand_intellect/council_motion.py"]}
