{"schema_version":"1.0","matter_id":"GI-COUNCIL-PROXY-DELEGATION-SCHEDULE-001","motion_sha256":"50c33099246c7780547c1d3d81b817e338c4680fbbd6f4bd770459baeecd917e","office":"axiomatist","reviewer_id":"agent-axiomatist-proxy-schedule-20260812-a","disposition":"table_for_human_steward_disposition","deliberation":"Time is not evidence and cadence is not authority. PT72H is coherent only if scope narrows to one closed class and every authority invariant remains mandatory. The exact window must start with a ratified UTC opening record; otherwise the original deadline controls.","discharged_obligations":["Separated temporal compression from evidentiary and constitutional sufficiency."],"findings":["No proof obligation may be waived for deadline pressure.","The underlying proxy proposal is not presently ratification-ready."],"amendments":["Use PT72H normatively and fail closed on every missing artifact."],"residual_uncertainty":["Representative baseline evidence may not be obtainable in seventy-two hours."],"evidence_refs":["CONSTITUTION.md:180-189","governance/steward_directives/GI-STEWARD-0002.md","governance/committees/GI-PROXY-DELEGATION-COMMITTEE-001-SCHEDULE-001.md"]}
