{"schema_version":"1.0","matter_id":"GI-COUNCIL-PROXY-DELEGATION-SCHEDULE-001","motion_sha256":"50c33099246c7780547c1d3d81b817e338c4680fbbd6f4bd770459baeecd917e","office":"verifier","reviewer_id":"agent-verifier-proxy-schedule-20260812-c","disposition":"table_for_human_steward_disposition","deliberation":"The schedule can accelerate packet assembly but cannot support safety claims without exact schemas, negative tests, shadow results, clean-state reproduction, digest closure, and ten terminal office records. Any post-test mutation invalidates the affected evidence.","discharged_obligations":["Defined reproducible and measurable submission gates."],"findings":["All ten current workstreams are pending.","Ratification now must concern only the schedule."],"amendments":["Reserve T+66 through T+70 for independent reproduction and exact readback."],"residual_uncertainty":["Test infrastructure and historical data availability remain unverified."],"evidence_refs":["governance/committees/GI-PROXY-DELEGATION-COMMITTEE-001.json","governance/council_matters/GI-COUNCIL-PROXY-DELEGATION-SCHEDULE-001/proposal.md"]}
