{"schema_version":"1.0","matter_id":"GI-COUNCIL-PROXY-DELEGATION-SCHEDULE-001","motion_sha256":"50c33099246c7780547c1d3d81b817e338c4680fbbd6f4bd770459baeecd917e","office":"amanuensis","reviewer_id":"agent-amanuensis-proxy-schedule-20260812-i","disposition":"table_for_human_steward_disposition","deliberation":"The original charter must remain an immutable predecessor. The accelerated addendum, opening record, work products, failures, terminal office records, renewed Council records, Human Steward act, integration, and readback require separate linked identities and timestamps sufficient for reconstruction without chat history.","discharged_obligations":["Specified custody, lineage, supersession, and status separation."],"findings":["A date-only constituted field cannot govern a seventy-two-hour mandate.","Failed and excluded classes must remain in the record."],"amendments":["Require canonical digests, authorship, timestamps, status, and supersession links for every artifact."],"residual_uncertainty":["The terminal manifest and custody implementation remain to be built."],"evidence_refs":["governance/committees/GI-PROXY-DELEGATION-COMMITTEE-001.json","governance/committees/GI-PROXY-DELEGATION-COMMITTEE-001-SCHEDULE-001.json"]}
