{"schema_version":"1.0","matter_id":"GI-COUNCIL-PROXY-DELEGATION-SCHEDULE-001","motion_sha256":"50c33099246c7780547c1d3d81b817e338c4680fbbd6f4bd770459baeecd917e","office":"steward","reviewer_id":"agent-council-steward-proxy-schedule-20260812-f","disposition":"table_for_human_steward_disposition","deliberation":"The ten-times cadence justifies reducing elapsed committee time when scope is reduced proportionately. One historical or isolated task class, one repository, no live authority, and a protected verification reserve preserve responsible stewardship while targeting the bottleneck promptly.","discharged_obligations":["Balanced urgency, operator burden, ownership, and safety."],"findings":["The accelerated programme has bounded cost and a clear failure route.","Council Steward advice is not Human Steward ratification."],"amendments":["Require named owners, kill switch, incident route, cost ceiling, expiry, and decommission plan in the terminal packet."],"residual_uncertainty":["The economic threshold may lack adequate samples."],"evidence_refs":["governance/steward_directives/GI-STEWARD-0002.md","governance/committees/GI-PROXY-DELEGATION-COMMITTEE-001-SCHEDULE-001.md"]}
