{
  "schema_version": "1.0",
  "matter_id": "GI-COUNCIL-PROXY-DELEGATION-001",
  "motion_sha256": "c2b6fea79163c6c4b78f02e76b4e3971b4b970bec655c8d243833e5d6e175482",
  "office": "referee",
  "reviewer_id": "openai-gpt-5.6-council-referee-proxy-delegation-001-20260811-g",
  "disposition": "convene_governance_rework_committee",
  "deliberation": "All nine prior reviews validate against the current canonical motion, occupy distinct required offices, use distinct reviewer identifiers, and select committee referral. I independently select the same disposition. The direction may reduce mechanical burden, but constitutional, semantic, classification, identity, credential, independence, threat, provenance, migration, operational, and test contracts are missing. Full quorum and unanimous affirmative disposition therefore convene only the temporary drafting, testing, and shadow-evaluation committee; they do not endorse either motion as effective policy or create proxy authority.",
  "discharged_obligations": ["Verified canonical binding, office coverage, reviewer separation, full quorum, unanimity, authority boundaries, and the bounded committee disposition.", "Reconciled office amendments into an ordered temporary committee charter."],
  "findings": ["All ten offices unanimously select convene_governance_rework_committee.", "A proxy act remains a machine act and cannot satisfy a direct human-action requirement.", "GI-STEWARD-0002 remains effective until the complete Article XI and Human Steward chain succeeds.", "Proxy authority must be non-amplifying and unknown or mixed work must stay under human review.", "Control-plane effects require semantic and transitive classification.", "Motion A infrastructure and shadow evidence must precede any Motion B exception.", "The committee must remain temporary and non-authoritative."],
  "amendments": ["Constitute all ten Council offices as the temporary committee for 30 days or until one exact packet is delivered.", "Limit work to research, drafting, schemas, isolated implementation, adversarial tests, measurement, and non-authoritative shadow evaluation.", "Produce an Article XI package, controlled vocabulary, contract schemas, classifier, non-amplifying authority model, independence matrix, credential and revocation controls, custody and migration plan, hostile tests, bounded pilot, and exact renewed-review packet.", "Limit the first shadow pilot to three task classes across two repositories with no live replacement of required human review.", "Require zero unauthorized acts, zero false-routine results, complete negative-case detection, zero attribution or replay errors, at least 70 percent handling-time reduction, and positive maintenance-adjusted savings.", "Return the exact packet for renewed full-quorum unanimous Council review before any Human Steward request."],
  "residual_uncertainty": ["Reviewer strings are distinct but are not cryptographic authentication or proof of independent invocation.", "No implementation, task inventory, classifier, credential system, permission matrix, corpus, cost evidence, migration inventory, or resolved INTELLECT/AETHER custody boundary exists."],
  "evidence_refs": ["CONSTITUTION.md:53", "CONSTITUTION.md:61-72", "CONSTITUTION.md:148-189", "governance/steward_directives/GI-STEWARD-0002.md", "src/grand_intellect/council_motion.py", "governance/council_matters/GI-COUNCIL-PROXY-DELEGATION-001/proposal.md", "governance/council_matters/GI-COUNCIL-PROXY-DELEGATION-001/reviews"]
}
