{"schema_version":"1.0","matter_id":"GI-COUNCIL-PROXY-DELEGATION-SCHEDULE-001","motion_sha256":"50c33099246c7780547c1d3d81b817e338c4680fbbd6f4bd770459baeecd917e","office":"grammarian","reviewer_id":"agent-grammarian-proxy-schedule-20260812-g","disposition":"table_for_human_steward_disposition","deliberation":"Three days is calendrically ambiguous; PT72H with exact UTC endpoints is normative. This is a schedule-ratification submission, not ratification of the proxy regime. Committee submission, Council concurrence, Human Steward disposition, integration, and effectiveness must remain distinct terms and records.","discharged_obligations":["Normalized timing and authority vocabulary across the package."],"findings":["The proposal now separates schedule ratification from underlying policy ratification."],"amendments":["Every surface must state current rules unchanged and no live proxy authority."],"residual_uncertainty":["Future UI labels may collapse the defined statuses."],"evidence_refs":["governance/council_matters/GI-COUNCIL-PROXY-DELEGATION-SCHEDULE-001/proposal.md","docs/COUNCIL_MATTERS.md"]}
