{"schema_version":"1.0","matter_id":"GI-COUNCIL-PROXY-DELEGATION-SCHEDULE-001","motion_sha256":"50c33099246c7780547c1d3d81b817e338c4680fbbd6f4bd770459baeecd917e","office":"adversary","reviewer_id":"agent-adversary-proxy-schedule-20260812-d","disposition":"table_for_human_steward_disposition","deliberation":"Deadline pressure amplifies omission, collusive review, stale evidence, test gaming, and premature-completion attacks. A fixed artifact freeze, distinct author and verifier sessions, seeded hostile cases, and zero-tolerance gates make the risk bounded enough for schedule ratification.","discharged_obligations":["Threat-modeled the accelerated process itself."],"findings":["Missing, flaky, ambiguous, or unreproducible evidence must fail.","No live credentials or protected integration may enter the sprint."],"amendments":["Freeze substantive work at T+60 and prohibit last-window patching."],"residual_uncertainty":["Cadence may increase coordination errors despite controls."],"evidence_refs":["governance/council_matters/GI-COUNCIL-PROXY-DELEGATION-001/reviews/04-adversary.json","governance/council_matters/GI-COUNCIL-PROXY-DELEGATION-SCHEDULE-001/proposal.md"]}
