{"schema_version":"1.0","matter_id":"GI-COUNCIL-PROXY-DELEGATION-SCHEDULE-001","motion_sha256":"50c33099246c7780547c1d3d81b817e338c4680fbbd6f4bd770459baeecd917e","office":"referee","reviewer_id":"agent-referee-proxy-schedule-20260812-j","disposition":"table_for_human_steward_disposition","deliberation":"All ten offices concur on one exact schedule motion and preserve the same authority boundary. The requested PT72H window is procedurally suitable for Human Steward consideration because it narrows scope and retains every safety and Article XI gate. It does not establish that the pending underlying work is complete or ratifiable.","discharged_obligations":["Reconciled the ten office findings and applied full-quorum unanimous-consent procedure."],"findings":["Full quorum is present and all dispositions are identical.","Only the schedule amendment is eligible for Human Steward disposition.","Underlying proxy authority remains unavailable."],"amendments":["On ratification, bind exact UTC endpoints and source digests before starting the sprint."],"residual_uncertainty":["Successful completion within PT72H is not guaranteed and must fail closed."],"evidence_refs":["governance/council_matters/GI-COUNCIL-PROXY-DELEGATION-SCHEDULE-001/motion.json","governance/council_matters/GI-COUNCIL-PROXY-DELEGATION-SCHEDULE-001/reviews","governance/steward_directives/GI-STEWARD-0002.md"]}
