{"schema_version":"1.0","matter_id":"GI-COUNCIL-PROXY-DELEGATION-SCHEDULE-001","motion_sha256":"50c33099246c7780547c1d3d81b817e338c4680fbbd6f4bd770459baeecd917e","office":"cartographer","reviewer_id":"agent-cartographer-proxy-schedule-20260812-b","disposition":"table_for_human_steward_disposition","deliberation":"A dependency-driven three-day topology is viable: authority and schema freeze precedes hostile validation, which precedes shadow replay, which precedes Article XI assembly and independent readback. The T+48 pre-pilot gate and T+66 acceptance gate prevent schedule pressure from reaching downstream authority edges.","discharged_obligations":["Mapped the accelerated critical path and authority barrier."],"findings":["Parallel work can shorten elapsed time without reordering prerequisites.","One class and one repository are the defensible initial terrain."],"amendments":["Block each failed node and all descendants; never infer completion."],"residual_uncertainty":["External repository and identity systems may not support isolated replay in time."],"evidence_refs":["governance/committees/GI-PROXY-DELEGATION-COMMITTEE-001.md","governance/council_matters/GI-COUNCIL-PROXY-DELEGATION-SCHEDULE-001/proposal.md"]}
